reviewId,userName,userImage,content,score,thumbsUpCount,reviewCreatedVersion,at,replyContent,repliedAt,appVersion,sortOrder,appId
3cae3359-1142-413c-82af-7578c03dece1,Calderon Nally,https://play-lh.googleusercontent.com/a/ACg8ocKamxgyaeyYTWArEzAkipxYBca965sw0IklJVxCFPB-tbZmAg=mo,Belum pernah salah pilih dengan aplikasi ini. Semua fitur berjalan lancar tanpa lag. Sempurna untuk yang butuh aplikasi finansial praktis di genggaman.,5,0,2.71.1,2024-10-31 11:43:55,"Hai, Sobat BRI. Terima kasih sudah menggunakan aplikasi BRImo, jangan lupa menggunakan fitur menarik lainnya yang memudahkan Sobat BRI dalam bertransaksi. Tks~Beni",2024-10-31 11:52:46,2.71.1,most_relevant,id.co.bri.brimo
3e993edd-0697-4375-bb2c-425d1c08832c,Hary zhocool,https://play-lh.googleusercontent.com/a-/ALV-UjVEDEv0LGAi3xFPfDodbqsC-xHrJF79T4mjgVQSkfj5iGDGbMI,"kenapa saya tidak bisa masuk akun brimo saya .haris verifikasi dulu ,linkndi kirim lewat sms sangat super lambat sekali ,waktu kirim link 3 menit ,tapi nyampe sms nya 10 menit kemudian jadi gak bisa akses .parah .jadi gak bisa transaksi lewat brimo .,tolong perbaiki akun saya ,saya sudah datang ke gerai bri terdekat tapi tetap aja gak bisa .hadeuh .",1,1,2.71.1,2024-10-31 16:44:33,"Hai, Sobat BRI. Mohon maaf atas kendala yang dialami, untuk tindak lanjutnya silahkan kirimkan detail kode respons yang tampil melalui Sabrina WhatsApp di 0812 1214 017 atau email callbri@bri.co.id. Jika sudah tidak mengalami kendala, kami harapkan bintang 5 dari Sobat BRI. Tks~Eshal",2024-10-31 22:11:11,2.71.1,most_relevant,id.co.bri.brimo
d2408d7c-3623-4b1e-941d-efceb9fad451,Everett Loly,https://play-lh.googleusercontent.com/a/ACg8ocJvIMUp743D_7vQPNHs9QOwdd48MHViz3Opt0fbzRMI9FiHyQ=mo,"Aplikasi ini beneran budget-friendly! Transaksi transfer dan bayar-bayar semua dapat cashback. Ini bikin pengeluaran lebih terkontrol. BRImo lagi, BRImo lagi, semua beres!",5,0,2.71.1,2024-10-31 16:50:45,"Hai, Sobat BRI. Terima kasih sudah menggunakan aplikasi BRImo, jangan lupa menggunakan fitur menarik lainnya yang memudahkan Sobat BRI dalam bertransaksi. Tks~Hiro",2024-10-31 19:47:38,2.71.1,most_relevant,id.co.bri.brimo
8af1ba96-c041-4284-99d6-f3f5cf0f3771,Arif Fudin,https://play-lh.googleusercontent.com/a/ACg8ocKM__4NDAF7Mba4z3eBFxSTm-qUCAmsEdtn2hKWC89mckDCsg=mo,"Ngebag mulu, baru di update bisa masuk, selepas kluar mau masuk lagi harus login. Sedangkan di masukan password malah ga bisa. Gimana ini kejelasan nya",3,0,2.71.1,2024-10-31 17:07:50,"Hai, Sobat BRI. Mohon maaf atas ketidaknyamanannya. Jika mengalami kendala, guna pengecekan dan tindak lanjut silakan kirimkan detail kendala melalui email callbri@bri.co.id. Jika sudah tidak mengalami kendala kami harapkan bintang 5 dari Sobat BRI. Tks~Arin",2024-11-01 02:24:32,2.71.1,most_relevant,id.co.bri.brimo
8af1ba96-c041-4284-99d6-f3f5cf0f3771,Arif Fudin,https://play-lh.googleusercontent.com/a/ACg8ocKM__4NDAF7Mba4z3eBFxSTm-qUCAmsEdtn2hKWC89mckDCsg=mo,"Ngebag mulu, baru di update bisa masuk, selepas kluar mau masuk lagi harus login. Sedangkan di masukan password malah ga bisa. Gimana ini kejelasan nya",3,0,2.71.1,2024-10-31 17:07:50,"Hai, Sobat BRI. Mohon maaf atas ketidaknyamanannya. Jika mengalami kendala, guna pengecekan dan tindak lanjut silakan kirimkan detail kendala melalui email callbri@bri.co.id. Jika sudah tidak mengalami kendala kami harapkan bintang 5 dari Sobat BRI. Tks~Arin",2024-11-01 02:24:32,2.71.1,newest,id.co.bri.brimo
a85de641-5eb3-442b-ae74-f2eb611af509,Bagus Dwi,https://play-lh.googleusercontent.com/a/ACg8ocKwQA1UbKNkpauRzGJW5leqoxLxNYdIzNp9BuJcU4AUtOK5jw=mo,Agak ribet kode pengesahan nggk terkirim di pesan,3,0,2.71.1,2024-10-31 17:25:42,"Hai, Sobat BRI. Mohon maaf atas ketidaknyamanannya. Jika mengalami kendala, guna pengecekan dan tindak lanjut silakan kirimkan detail kendala melalui email callbri@bri.co.id. Jika sudah tidak mengalami kendala kami harapkan bintang 5 dari Sobat BRI. Tks~Arin",2024-11-01 02:24:25,2.71.1,newest,id.co.bri.brimo
16bb71e8-d12b-4cd6-a2e3-c0a14554b626,Tania Rina,https://play-lh.googleusercontent.com/a/ACg8ocKwdhjHa1gKoSV5NWMKaG_ModzO47Gw3aF8sp9QN-gPeNZ38A=mo,Belanja pke qris brimo sudah scan Dan saldo dimutasi sudah terpotong tp saldo tidak msk kemerchant dan dicek transaksi msh proses jg sudah dr jam 9.00 sampai skrg jam 18.00 belum ada kejelasan msh proses saja.dan transaksi ga bisa dibatalin.kta cs klo sudah normal transaksi msk kemerchant lah.trus klo msk kmerchant gimana sy ambil uangnya mana mau merchant balikin.telpn cs suruh nunggu 14hr kerja.aduhh krg lama apa,1,1,2.71.1,2024-10-31 17:59:32,"Hai, Sobat BRI. Mohon maaf atas kendala yang dialami. Untuk tindak lanjut, silakan kirimkan detail kendala melalui Sabrina Whatsapp 0812 1214 017 atau email callbri@bri.co.id. Jika sudah tidak mengalami kendala, kami harapkan bintang 5 dari Sobat BRI. Tks~Nadim",2024-11-01 06:42:08,2.71.1,most_relevant,id.co.bri.brimo
f3247719-b2e6-499c-8d8c-d1d70ebbc717,Joko Hermanto,https://play-lh.googleusercontent.com/a-/ALV-UjVGwfHTPrVP5kzypC9xQ3UTC43NQ6ng2Ie0hAnFG_kGfXVfwPYD,"Tolong perbaiki saat pembelian pulsa masih dalam proses tapi saldo sudah di potong, saat pelaporan riwayat pembelian tidak ada,? Mohon di bantu prosesnya.",4,0,2.71.1,2024-10-31 19:23:58,"Hai, Sobat BRI. Mohon maaf atas ketidaknyamanan yang dialami. Agar hal ini dapat kami lakukan tindak lanjut, mohon sampaikan detail kendala melalui email callbri@bri.co.id. Apabila sudah tidak mengalami kendala, kami harapkan bintang 5 dari Sobat BRI. Tks~Priska
",2024-11-03 05:19:47,2.71.1,most_relevant,id.co.bri.brimo
35a35a76-5b7b-42f6-8146-c9b5d65a2dc1,Jaka Slamet23,https://play-lh.googleusercontent.com/a/ACg8ocJsdqVEfvSyh9yp16fR6NfJL_qDFHgVTejmOBrrZ1zcH3U25Q=mo,Bagaimana cara mengikuti kuis No,3,0,2.70.0,2024-10-31 22:08:49,"Hai, Sobat BRI. Tidak perlu khawatir. Guna pengecekan dan tindak lanjut silakan kirimkan detail kuis yang dimaksud melalui Sabrina Whatsapp 0812 1214 017 atau email callbri@bri.co.id. Jika sudah tidak mengalami kendala kami harapkan bintang 5 dari Sobat BRI. Tks~Arin",2024-11-01 02:29:08,2.70.0,newest,id.co.bri.brimo
dc1f864b-94cf-4f4c-93a6-a6842dbd684b,Imam Prasetyo,https://play-lh.googleusercontent.com/a/ACg8ocK6x-U_yH7OY5K8vtljbPiGO1eN77GSEbTtGCweb8u6FpEmEA=mo,"Aplikasi ini pada dasarnya membantu dlm mempersingkat jarak dan waktu, tetapi ketika ada kejadian transaksi gagal , maka sudah dipastikan uang anda terpotong sebesar transaksi tsb, hal inilah yg terjadi pada saya , hingga harus ke BRI utk ajukan pengaduan dan tanggapan kembali uang dlm tempo 3 hari, inilah yg membuat saya ndongkol, sudah buang waktu, masih menunggu 3 hari, jlimet pengaduannya, mungkin sebagian saran ... kalau memang transaksi gagal ( aplikasi brimo) , mbok Yao jangan motong dana",1,0,2.71.1,2024-10-31 22:09:19,"Hai, Sobat BRI. Mohon maaf atas kendala yang dialami. Untuk tindak lanjut, silakan kirimkan detail kendala melalui Sabrina Whatsapp 0812 1214 017 atau email callbri@bri.co.id. Jika sudah tidak mengalami kendala, kami harapkan bintang 5 dari Sobat BRI. Tks~Arin",2024-11-01 02:05:06,2.71.1,most_relevant,id.co.bri.brimo
02bc1795-5da4-40e1-a03a-7f208a4361ce,Sloan Lesher,https://play-lh.googleusercontent.com/a/ACg8ocJA_O3YK2uPdhqN1wBPL9Uh1qAVJA2fR0AxVu307gVvHFZ1OA=mo,"Ngurus pembayaran tagihan jadi lebih simpel. Tinggal buka BRImo, pilih bayar, dan selesai. Sangat membantu, apalagi saat deadline biasanya saya suka panik!",5,0,2.71.1,2024-11-01 00:13:58,"Hai, Sobat BRI. Terima kasih sudah menggunakan aplikasi BRImo, jangan lupa menggunakan fitur menarik lainnya yang memudahkan Sobat BRI dalam bertransaksi. Tks~Arin",2024-11-01 04:05:14,2.71.1,most_relevant,id.co.bri.brimo
c3e4c0c6-721e-47bd-9dbd-932aff8a6c4c,Raine 18,https://play-lh.googleusercontent.com/a/ACg8ocJ2-icVgpiVSstZ0sqDXTfRLPDfOF8k7Uf7n3yKz4tiKWkcSg=mo,"Akun brimo ku terblokir dan pas ingin login ulang lewat lupa password selalu tidak bisa login lagi padahal sudah ku isi sesuai dengan biodata yang terdaftar di akun tersebut. Aku sudah hubungi akun brimo via WhatsApp dan katanya jaringan internet ku saja yang bermasalah padahal jaringan internet ku baik saja, aku juga sudah mencoba membuat akun brimo yang baru tapi selalu tidak bisa lanjut dikarenakan bermasalah padahal jaringan internet juga bagus, tolong kemudahannya.",2,0,2.71.1,2024-11-01 01:35:34,"Hai, Sobat BRI. Mohon maaf atas ketidaknyamanannya. Jika mengalami kendala, guna pengecekan dan tindak lanjut silakan kirimkan detail kendala melalui email callbri@bri.co.id. Jika sudah tidak mengalami kendala kami harapkan bintang 5 dari Sobat BRI. Tks~Arin",2024-11-01 02:23:06,2.71.1,most_relevant,id.co.bri.brimo
56046411-65ff-489b-9bb1-8a3566639ed8,Laily Luthfiyah,https://play-lh.googleusercontent.com/a-/ALV-UjUemf2YqntVBR-GOSK_yjE5dllmpFmmP93TcsRiRPhgzamYdwdOQA,sering banget kesusahan kalau login,3,0,2.71.1,2024-11-01 03:09:38,"Hai, Sobat BRI. Mohon maaf atas ketidaknyamanannya. Jika mengalami kendala, guna pengecekan dan tindak lanjut silakan kirimkan detail kendala melalui Sabrina Whatsapp 0812 1214 017 atau email callbri@bri.co.id. Jika sudah tidak mengalami kendala kami harapkan bintang 5 dari Sobat BRI. Tks~Arin",2024-11-01 03:49:16,2.71.1,newest,id.co.bri.brimo
239ece20-e513-4fca-9250-beb7d156099f,Zxcaim Zoe,https://play-lh.googleusercontent.com/a/ACg8ocJ_WF9gdappJw1wElo4dlhEq5QH7dIBPDeMI0Oy7mfb1x4NZA=mo,"1. Sering keluar aplikasi 2. Keika cek menu pemasukan/pengeluaran, tiba-tiba kembali kemenu awal 3. Loading lama untuk melihat list pemasukan 4. Mohon untuk segera diperbaiki, update selanjutnya",1,0,2.71.1,2024-11-01 03:39:54,"Hai, Sobat BRI. Mohon maaf atas kendala yang dialami. Untuk tindak lanjut, silakan kirimkan detail kendala melalui Sabrina Whatsapp 0812 1214 017 atau email callbri@bri.co.id. Jika sudah tidak mengalami kendala, kami harapkan bintang 5 dari Sobat BRI. Tks~Arin",2024-11-01 03:45:58,2.71.1,most_relevant,id.co.bri.brimo
3d57fbb8-90a9-4341-b441-a0c94a5dd8d5,ARIFAH SOFINGAH,https://play-lh.googleusercontent.com/a/ACg8ocKzJoyE_lHzEQPQ6gl_Wg3Cd1fUlOo1_Sn5h2rFMbwJiIq6Qw=mo,Kenapa saat pebdaftaran brimo konfirmasi password tidak bisa di pencet ya kak,3,0,2.71.1,2024-11-01 04:11:39,"Hai, Sobat BRI. Mohon maaf atas ketidaknyamanannya. Jika mengalami kendala, guna pengecekan dan tindak lanjut silakan kirimkan detail kendala melalui Sabrina Whatsapp 0812 1214 017 atau email callbri@bri.co.id. Jika sudah tidak mengalami kendala kami harapkan bintang 5 dari Sobat BRI. Tks~Arin",2024-11-01 04:23:25,2.71.1,most_relevant,id.co.bri.brimo
3d57fbb8-90a9-4341-b441-a0c94a5dd8d5,ARIFAH SOFINGAH,https://play-lh.googleusercontent.com/a/ACg8ocKzJoyE_lHzEQPQ6gl_Wg3Cd1fUlOo1_Sn5h2rFMbwJiIq6Qw=mo,Kenapa saat pebdaftaran brimo konfirmasi password tidak bisa di pencet ya kak,3,0,2.71.1,2024-11-01 04:11:39,"Hai, Sobat BRI. Mohon maaf atas ketidaknyamanannya. Jika mengalami kendala, guna pengecekan dan tindak lanjut silakan kirimkan detail kendala melalui Sabrina Whatsapp 0812 1214 017 atau email callbri@bri.co.id. Jika sudah tidak mengalami kendala kami harapkan bintang 5 dari Sobat BRI. Tks~Arin",2024-11-01 04:23:25,2.71.1,newest,id.co.bri.brimo
292a585c-6b30-491a-9ae6-f93937bc5ad8,Asran Prtma,https://play-lh.googleusercontent.com/a-/ALV-UjXBuPdfoH3jCDkACsJlIMoBMTxRF4saQMm5T_F2w1zHs42X5Icc,Nom .,3,0,2.71.0,2024-11-01 05:45:00,"Hai, Sobat BRI. Mohon maaf atas kendala yang dialami. Untuk tindak lanjut, silakan kirimkan detail kendala melalui Sabrina Whatsapp 0812 1214 017 atau email callbri@bri.co.id. Jika sudah tidak mengalami kendala, kami harapkan bintang 5 dari Sobat BRI. Tks~Nadim",2024-11-01 06:36:29,2.71.0,newest,id.co.bri.brimo
997c3194-ac3f-4b03-9250-f33ac6dd8530,Mckinney Lagrange,https://play-lh.googleusercontent.com/a/ACg8ocL5l0XT3pDgX_z8FGisHXEVyhq6bekQFiNj_jehYk3r4fC26g=mo,"Fitur bermanfaat banget! Bisa beli tiket transportasi, ngga ribet sama sekali. Lebih hemat waktu dan tenaga, dan ga perlu lagi ngantri di pemandangan!",5,0,2.71.1,2024-11-01 05:58:21,"Hai, Sobat BRI. Terima kasih sudah menggunakan aplikasi BRImo, jangan lupa menggunakan fitur menarik lainnya yang memudahkan Sobat BRI dalam bertransaksi. Tks~Arin",2024-11-01 06:01:30,2.71.1,most_relevant,id.co.bri.brimo
d39eff6b-87d8-4ea5-8bec-555f08c65bb8,Fitria,https://play-lh.googleusercontent.com/a/ACg8ocLSEN8Gkw7g61jj-AyljY6IzTas7FWyVU-qiwhsS_TiSOiM0Q=mo,Good,3,0,2.71.1,2024-11-01 09:03:21,"Hai, Sobat BRI. Terima kasih atas ulasannya. Apabila sudah tidak mengalami kendala, kami harapkan bintang 5 dari Sobat BRI. Tks~Arin",2024-11-01 09:38:24,2.71.1,newest,id.co.bri.brimo
12b61e2d-4ff0-425c-8489-8c20e98d8349,Jeki Mardiansyah,https://play-lh.googleusercontent.com/a/ACg8ocIX4Pn5QZH4VdUUu7xksnPAWzcM2ppnLGQS5pIoAFt8CT4oljU=mo,"Untuk aplikasi sangat membantu buat transaksi, saran dari saya untuk pitur tarik tunai tolong adakan pilihan nominal jumlah untuk tarik tunai nya , semisalkan mau tarik tunai uang Rp. 50.000 itukan tidak bisa minimal jumlah penarikan lewat BRI mobile harus Rp.100.000 itu sangat di sayangkan sekali , untuk kedepannya mohon tambahkan fitur pilih jumlah nominal penarikan nya supaya lebih mudah dalam melakukan transaksi, mohon di tanggapi ulasan saya 🙏🙏🙏",5,1,2.71.1,2024-11-01 11:17:50,"Hai, Sobat BRI. Kami mohon maaf atas kendala yang dialami. Terima kasih atas saran dan masukannya. Hal tersebut akan menjadi perhatian utama Bank BRI kedepannya dalam meningkatkan kualitas layanan nasabah. Tks~Winni",2024-11-02 04:13:17,2.71.1,most_relevant,id.co.bri.brimo
93b11523-7661-42aa-bec4-1fa009996276,Benediktus Basri,https://play-lh.googleusercontent.com/a/ACg8ocLuxSXG6pjG5mow0ckobEp9-r4WhDQExcsdLFNkGaRwoluINw=mo,Kok setelah diperbaharui ngak bisa masuk log-in di bilng nya Koneksi jelek padahal bagus bagus aja paket saya juga udah di isi Gimana sihhh,2,0,2.71.1,2024-11-01 11:19:55,"Hai, Sobat BRI. Mohon maaf atas kendala yang dialami. Untuk tindak lanjutnya silakan kirimkan detail kendala melalui email callbri@bri.co.id. Apabila sudah tidak mengalami kendala, kami harapkan bintang 5 dari Sobat BRI. Tks~Winni

",2024-11-02 02:25:21,2.71.1,most_relevant,id.co.bri.brimo
60eee987-69a1-4f33-92a6-534659679f13,Muslimin 987,https://play-lh.googleusercontent.com/a-/ALV-UjW-b4lu3CwJ_h7jZTv4GEtHbV3Wq_aVB0UC8N-VDMK2z-utlBs,"Kebanyakan gangguan, jaringan bagus di bilang masalah koneksi jadi gabisa login sama sekali,mohon di perbaikin pelayanan nya, lama lama saya capek pakai brimo",3,0,2.71.1,2024-11-01 11:22:28,"Hai, Sobat BRI. Mohon maaf atas kendala yang dialami. Untuk tindak lanjutnya silakan kirimkan detail kendala melalui email callbri@bri.co.id. Apabila sudah tidak mengalami kendala, kami harapkan bintang 5 dari Sobat BRI. Tks~Winni

",2024-11-02 03:45:20,2.71.1,most_relevant,id.co.bri.brimo
60eee987-69a1-4f33-92a6-534659679f13,Muslimin 987,https://play-lh.googleusercontent.com/a-/ALV-UjW-b4lu3CwJ_h7jZTv4GEtHbV3Wq_aVB0UC8N-VDMK2z-utlBs,"Kebanyakan gangguan, jaringan bagus di bilang masalah koneksi jadi gabisa login sama sekali,mohon di perbaikin pelayanan nya, lama lama saya capek pakai brimo",3,0,2.71.1,2024-11-01 11:22:28,"Hai, Sobat BRI. Mohon maaf atas kendala yang dialami. Untuk tindak lanjutnya silakan kirimkan detail kendala melalui email callbri@bri.co.id. Apabila sudah tidak mengalami kendala, kami harapkan bintang 5 dari Sobat BRI. Tks~Winni

",2024-11-02 03:45:20,2.71.1,newest,id.co.bri.brimo
c3bcb658-a164-458b-af6e-6a7f8b673a45,IRVAN NOAB,https://play-lh.googleusercontent.com/a/ACg8ocLpe4vZCWFvxC5khygvm5cVld5Rhlzb5lb1TqSPL5STlVq0dA=mo,Kenapa brimo saya gabisa di buka,3,0,2.71.1,2024-11-01 11:22:56,"Hai, Sobat BRI. Mohon maaf atas kendala yang dialami. Untuk tindak lanjutnya silakan kirimkan detail kendala melalui email callbri@bri.co.id. Apabila sudah tidak mengalami kendala, kami harapkan bintang 5 dari Sobat BRI. Tks~Winni

",2024-11-02 03:45:04,2.71.1,newest,id.co.bri.brimo
35a8b7bb-4b60-4a14-85c4-eadfde3b56af,12_Ketut Darma yasa,https://play-lh.googleusercontent.com/a-/ALV-UjVjFphNt6y2oVpNPpE0c_oJjKrbsld7lPjr0poOKRYHQCVDFnI,"mohon di updet lagi sistemnya ya admin, kok login saja di bilang sinyal kurang bagus,padahal semua aplikasi bisa di buka,kok buka brimo susah.",1,0,2.71.1,2024-11-01 11:23:31,"Hai, Sobat BRI. Mohon maaf atas kendala yang dialami. Untuk tindak lanjut, silakan kirimkan detail kendala melalui Sabrina Whatsapp 0812 1214 017 atau email callbri@bri.co.id. Jika sudah tidak mengalami kendala, kami harapkan bintang 5 dari Sobat BRI. Tks~Nadim",2024-11-01 13:07:53,2.71.1,most_relevant,id.co.bri.brimo
d7c41c1b-3649-464e-86a6-ffef1806f560,safitri nur,https://play-lh.googleusercontent.com/a/ACg8ocLCfcKyKiGDWwEzVp0yhj7oJ72SQmfCA5sf9oz9gwkhzTW8pw=mo,Kak hari ini brimo kenapa ko ga ada koneksi terus pdhl sinyal aku bagusssssss,3,0,,2024-11-01 11:23:56,"Hai, Sobat BRI. Mohon maaf atas kendala yang dialami. Untuk tindak lanjutnya silakan kirimkan detail kendala melalui email callbri@bri.co.id. Apabila sudah tidak mengalami kendala, kami harapkan bintang 5 dari Sobat BRI. Tks~Winni

",2024-11-02 03:44:33,,newest,id.co.bri.brimo
1f06da34-b88c-4ba1-82a7-e95284e5e746,Reiza Henggar,https://play-lh.googleusercontent.com/a-/ALV-UjUWoNHvyw7Qq8mihXwnMKdVnAzj0eMeMgObo8v3XT-lM7OtFpw,"Jaringan buruk gak bisa di buka , padahal sinyal bagus full terus 5 strip , tapi jaringan buruk anehh",3,0,2.71.1,2024-11-01 11:25:11,"Hai, Sobat BRI. Mohon maaf atas kendala yang dialami. Untuk tindak lanjutnya silakan kirimkan detail kendala melalui email callbri@bri.co.id. Apabila sudah tidak mengalami kendala, kami harapkan bintang 5 dari Sobat BRI. Tks~Winni

",2024-11-02 03:44:27,2.71.1,most_relevant,id.co.bri.brimo
1f06da34-b88c-4ba1-82a7-e95284e5e746,Reiza Henggar,https://play-lh.googleusercontent.com/a-/ALV-UjUWoNHvyw7Qq8mihXwnMKdVnAzj0eMeMgObo8v3XT-lM7OtFpw,"Jaringan buruk gak bisa di buka , padahal sinyal bagus full terus 5 strip , tapi jaringan buruk anehh",3,0,2.71.1,2024-11-01 11:25:11,"Hai, Sobat BRI. Mohon maaf atas kendala yang dialami. Untuk tindak lanjutnya silakan kirimkan detail kendala melalui email callbri@bri.co.id. Apabila sudah tidak mengalami kendala, kami harapkan bintang 5 dari Sobat BRI. Tks~Winni

",2024-11-02 03:44:27,2.71.1,newest,id.co.bri.brimo
ba359cb3-ad06-419c-b5fd-14c1b30aaca7,Agung Nugroho,https://play-lh.googleusercontent.com/a-/ALV-UjXQxVI4nM3BoupEThN7SMURyndF4eXVLrrvRe76JnyWYxMDegch,"Sinyal bagus, tapi kenapa kok pas login ada kendala di koneksi internet ya.. Padahal kuota ada, sinyal bagus, coba pake wifi juga ada peringatan untuk periksa koneksi internet...kuota padahal ada loh.. Kenapa ga bisa login ya?... Solusinya gimana...",5,2,2.71.1,2024-11-01 11:29:54,"Terima kasih atas ulasannya. Mohon maaf atas kendala yang dialami, Silahkan kirimkan detail kendala melalui email callbri@bri.co.id. Tks~Winni

",2024-11-02 04:10:36,2.71.1,most_relevant,id.co.bri.brimo
055de1c0-77ca-4653-99c8-3b66629b7bd3,Sammy shiddiq,https://play-lh.googleusercontent.com/a-/ALV-UjU20I5ZKlLFpgb-3ez8x21nT2uWyKoySIGLMjDpdrYyzo_SP-k,koneksi bagus tapi tidak bisa buka anehh,3,0,2.71.1,2024-11-01 11:33:04,"Hai, Sobat BRI. Mohon maaf atas kendala yang dialami. Untuk tindak lanjutnya silakan kirimkan detail kendala melalui email callbri@bri.co.id. Apabila sudah tidak mengalami kendala, kami harapkan bintang 5 dari Sobat BRI. Tks~Winni

",2024-11-02 03:43:39,2.71.1,newest,id.co.bri.brimo
0e95875a-df3e-4f91-8cde-89d11f6d74fa,Merli Sandha,https://play-lh.googleusercontent.com/a-/ALV-UjUfV29h4MUoNTHvQcivmlZ2HFiCIGo3KEthep3_7D5E06cpZWag,"asliii kesell bgtt, ni apk knp se lemot ini sihh? udah coba segala cara biar login tapi selalu gabisa dan keterangannya selalu sama ""koneksi internetmu kurang baik"" udah bolak balik ganti wifi ke data tapi masih begituu. padahal lagu butuh bgt buat transaksii yaampunnnn",2,6,2.71.1,2024-11-01 11:33:26,"Hai, Sobat BRI. Mohon maaf atas kendala yang dialami. Untuk tindak lanjutnya silakan kirimkan detail kendala melalui email callbri@bri.co.id. Apabila sudah tidak mengalami kendala, kami harapkan bintang 5 dari Sobat BRI. Tks~Winni",2024-11-02 02:22:26,2.71.1,most_relevant,id.co.bri.brimo
35efe70a-64e0-4836-a19d-e4eedf529ac7,Dana Umum,https://play-lh.googleusercontent.com/a-/ALV-UjUWrQ06Dd0R03HdQP1RU41fGYF55dzbyuyR0xMO0R5kVlafte0,"Ounya saya tidak bisa login, ada tulisan jaringan kurang baik, padahal saya pake wifi dan juga pake data seluler buat buka apk lain lancar2 saja",1,0,2.71.1,2024-11-01 11:34:18,"Hai, Sobat BRI. Mohon maaf atas kendala yang dialami. Untuk tindak lanjut, silakan kirimkan detail kendala melalui Sabrina Whatsapp 0812 1214 017 atau email callbri@bri.co.id. Jika sudah tidak mengalami kendala, kami harapkan bintang 5 dari Sobat BRI. Tks~Nadim",2024-11-01 13:07:22,2.71.1,most_relevant,id.co.bri.brimo
92c1de9a-22dd-4962-b722-0b2ded16c2ec,Rifani Fani,https://play-lh.googleusercontent.com/a/ACg8ocKjX4ZXRQ7rREZb-qdwekUjDAnZ_ngTqAV-_5M9xZwLjjWZYQ=mo,Maaf kanapa brimo di waktu ini tidak bisa di buka ya,3,0,2.71.1,2024-11-01 11:35:13,"Hai, Sobat BRI. Mohon maaf atas kendala yang dialami. Untuk tindak lanjutnya silakan kirimkan detail kendala melalui email callbri@bri.co.id. Apabila sudah tidak mengalami kendala, kami harapkan bintang 5 dari Sobat BRI. Tks~Winni

",2024-11-02 03:43:34,2.71.1,newest,id.co.bri.brimo
40fedb4c-fc30-41fd-9f7d-0ec34171d583,AISYAH,https://play-lh.googleusercontent.com/a/ACg8ocJLLibWyq9WSMXsr9luZC-x23jBsAH8L4BDloF2KRThwXvNfA=mo,"Ini brimo lagi gangguan kah? Padahal sinyal udah sangat bagus, pake Wifi lancar. Pake Data seluler juga lancar. Eh pas buat login malah ada keterangan ""Koneksi terputus"" . Kenapa siiih?",3,0,2.71.1,2024-11-01 11:35:50,"Hai, Sobat BRI. Mohon maaf atas kendala yang dialami. Untuk tindak lanjutnya silakan kirimkan detail kendala melalui email callbri@bri.co.id. Apabila sudah tidak mengalami kendala, kami harapkan bintang 5 dari Sobat BRI. Tks~Winni

",2024-11-02 03:43:05,2.71.1,most_relevant,id.co.bri.brimo
40fedb4c-fc30-41fd-9f7d-0ec34171d583,AISYAH,https://play-lh.googleusercontent.com/a/ACg8ocJLLibWyq9WSMXsr9luZC-x23jBsAH8L4BDloF2KRThwXvNfA=mo,"Ini brimo lagi gangguan kah? Padahal sinyal udah sangat bagus, pake Wifi lancar. Pake Data seluler juga lancar. Eh pas buat login malah ada keterangan ""Koneksi terputus"" . Kenapa siiih?",3,0,2.71.1,2024-11-01 11:35:50,"Hai, Sobat BRI. Mohon maaf atas kendala yang dialami. Untuk tindak lanjutnya silakan kirimkan detail kendala melalui email callbri@bri.co.id. Apabila sudah tidak mengalami kendala, kami harapkan bintang 5 dari Sobat BRI. Tks~Winni

",2024-11-02 03:43:05,2.71.1,newest,id.co.bri.brimo
73b61c18-6cfc-494a-9c6a-023365445e2d,Rizal Pratama,https://play-lh.googleusercontent.com/a/ACg8ocJct9QDzxi7lC4072TI3_-S7yYiE7LH_cQ5oDgubL_gdrIojg=mo,kenapa saya gak bisa login katanya periksa koneksi internet padahal sudah pake wifi tetap gak bisa,3,0,2.71.1,2024-11-01 11:37:02,"Hai, Sobat BRI. Mohon maaf atas kendala yang dialami. Untuk tindak lanjutnya silakan kirimkan detail kendala melalui email callbri@bri.co.id. Apabila sudah tidak mengalami kendala, kami harapkan bintang 5 dari Sobat BRI. Tks~Winni

",2024-11-02 03:40:41,2.71.1,most_relevant,id.co.bri.brimo
73b61c18-6cfc-494a-9c6a-023365445e2d,Rizal Pratama,https://play-lh.googleusercontent.com/a/ACg8ocJct9QDzxi7lC4072TI3_-S7yYiE7LH_cQ5oDgubL_gdrIojg=mo,kenapa saya gak bisa login katanya periksa koneksi internet padahal sudah pake wifi tetap gak bisa,3,0,2.71.1,2024-11-01 11:37:02,"Hai, Sobat BRI. Mohon maaf atas kendala yang dialami. Untuk tindak lanjutnya silakan kirimkan detail kendala melalui email callbri@bri.co.id. Apabila sudah tidak mengalami kendala, kami harapkan bintang 5 dari Sobat BRI. Tks~Winni

",2024-11-02 03:40:41,2.71.1,newest,id.co.bri.brimo
f4dd032a-a6b6-4518-99b0-415228895da0,Roy Andre,https://play-lh.googleusercontent.com/a/ACg8ocL84PvSC9c4jw185UlUxXevcdIgitH8iy5zSatBk1iZA-hjHw=mo,"Terlalu sering gangguan,waktu login koneksi kurang baik,padahal udh pakai wifi dan data seluler masih banyak juga kita punya sinyal full,segera perbaiki aplikasi ini",1,0,2.71.1,2024-11-01 11:37:21,"Hai, Sobat BRI. Mohon maaf atas kendala yang dialami. Untuk tindak lanjut, silakan kirimkan detail kendala melalui Sabrina Whatsapp 0812 1214 017 atau email callbri@bri.co.id. Jika sudah tidak mengalami kendala, kami harapkan bintang 5 dari Sobat BRI. Tks~Nadim",2024-11-01 13:07:06,2.71.1,most_relevant,id.co.bri.brimo
1d86d871-aad4-4b97-97c7-a9b5a69c7c30,R anjarsyy,https://play-lh.googleusercontent.com/a-/ALV-UjWyWkQX_Lu8OqSVHvL2Mh9qZ_sl3Z5Vne6ysLcV38SMY6WYu0_N,Ini brimo kenapa yah ? Kok gak bisa di buka alasannya koneksi internet kurang baik padahal jaringan bagus bgt buka ytb dll semua bisa brimo aja gak bisa kenapa yah?,2,0,2.71.1,2024-11-01 11:37:25,"Hai, Sobat BRI. Mohon maaf atas kendala yang dialami. Untuk tindak lanjutnya silakan kirimkan detail kendala melalui email callbri@bri.co.id. Apabila sudah tidak mengalami kendala, kami harapkan bintang 5 dari Sobat BRI. Tks~Winni

",2024-11-02 02:20:44,2.71.1,most_relevant,id.co.bri.brimo
f13d9e08-5b24-4235-b48e-681c82cfdec1,Eka Susanty,https://play-lh.googleusercontent.com/a-/ALV-UjUefryO3b-rPeTfWSBSIQ0j7HDAEihniUZ8pgKn0lo7JeLtHhEV,NI BRIMO GI EROR KAH .. KOK GA BISA LOGIN ... PADAHAL JARINGAN FULL PKE WIFI PUN OKE TAPI TETEP GA BIASA LOGIN JUGA !!,3,0,2.71.1,2024-11-01 11:37:53,"Hai, Sobat BRI. Mohon maaf atas kendala yang dialami. Untuk tindak lanjutnya silakan kirimkan detail kendala melalui email callbri@bri.co.id. Apabila sudah tidak mengalami kendala, kami harapkan bintang 5 dari Sobat BRI. Tks~Winni

",2024-11-02 03:39:39,2.71.1,newest,id.co.bri.brimo
